{
  "schema": "gentle-ai.work-verification-decide/v1",
  "contract": "gentle-ai.work-verification-decide/v1",
  "workRunId": "work-advance-v2-checkpoint-fixture",
  "previousRevision": "sha256:bbbbbbbbbbbbbbbbbbbbbbbbbbbbbbbbbbbbbbbbbbbbbbbbbbbbbbbbbbbbbbbb",
  "promptRef": "sha256:373d6d710517babd9764f55b9715f067187b889352a7571c04f4a045f0d9905c",
  "forecastRef": "sha256:cccccccccccccccccccccccccccccccccccccccccccccccccccccccccccccccc",
  "assumptionsRef": "sha256:cccccccccccccccccccccccccccccccccccccccccccccccccccccccccccccccc",
  "choice": "run",
  "dispositionRef": "sha256:eeeeeeeeeeeeeeeeeeeeeeeeeeeeeeeeeeeeeeeeeeeeeeeeeeeeeeeeeeeeeeee",
  "status": {
    "schema": "gentle-ai.work-status/v1",
    "contract": "gentle-ai.work-status/v1",
    "workRunId": "work-advance-v2-checkpoint-fixture",
    "revision": "sha256:ffffffffffffffffffffffffffffffffffffffffffffffffffffffffffffffff",
    "publicState": "checking",
    "routeDecision": "direct_inline",
    "routePhase": "implementation_selected",
    "implementationRoute": "direct_inline",
    "verification": {
      "outcome": "pending",
      "resultRefs": []
    },
    "deliveryIntentRef": "sha256:dddddddddddddddddddddddddddddddddddddddddddddddddddddddddddddddd"
  }
}
